{
    "$schema": "../../facility.schema.json",
    "name": "Filippe",
    "class": "TRAINER_CLASS_POKEFAN_M",
    "pokemon": [
        "rapidash_1",
        "muk_1",
        "gengar_1",
        "ampharos_1",
        "politoed_1",
        "pinsir_1",
        "scizor_1",
        "heracross_1",
        "ursaring_1",
        "houndoom_1",
        "donphan_1",
        "wailord_1",
        "claydol_1",
        "bronzong_1",
        "drapion_1",
        "luxray_1",
        "ninetales_1",
        "machamp_1",
        "shuckle_1",
        "roserade_1",
        "honchkrow_1",
        "gigalith_1",
        "conkeldurr_1",
        "excadrill_1",
        "krookodile_1",
        "steelix_1",
        "weavile_1",
        "gliscor_1",
        "zoroark_1",
        "mandibuzz_1",
        "braviary_1",
        "tentacruel_1",
        "aerodactyl_1",
        "porygon2_1",
        "lickilicky_1",
        "yanmega_1",
        "gardevoir_1",
        "gallade_1",
        "exeggutor_1",
        "starmie_1",
        "flygon_1",
        "klinklang_1",
        "chandelure_1",
        "vaporeon_1",
        "jolteon_1",
        "flareon_1",
        "espeon_1",
        "umbreon_1",
        "leafeon_1",
        "glaceon_1",
        "lucario_1",
        "hippowdon_1",
        "probopass_1",
        "dusknoir_1",
        "mienshao_3",
        "beartic_3",
        "bouffalant_3",
        "aggron_1",
        "walrein_1",
        "mamoswine_1",
        "lapras_1",
        "crobat_1",
        "magnezone_1",
        "rhyperior_1",
        "tangrowth_1",
        "porygon_z_1",
        "vanilluxe_1",
        "eelektross_1",
        "gyarados_1",
        "snorlax_1",
        "kingdra_1",
        "blissey_1",
        "milotic_1",
        "electivire_1",
        "magmortar_1",
        "haxorus_1",
        "togekiss_1",
        "volcarona_1",
        "arcanine_1",
        "archeops_1",
        "dragonite_1",
        "tyranitar_1",
        "salamence_1",
        "metagross_1",
        "garchomp_1",
        "hydreigon_1",
        "slaking_1"
    ],
    "messages": [
        "I am not a regular Pokéfan.\nI am a major mega-Pokéfan!",
        "I love Pokémon.\nI love love Pokémon!",
        "You'll remember this!\nI am a big Pokéfan!"
    ]
}
