{
    "$schema": "../../facility.schema.json",
    "name": "Turtle",
    "class": "TRAINER_CLASS_DOCTOR",
    "pokemon": [
        "gurdurr_2",
        "fraxure_2",
        "mienshao_2",
        "servine_2",
        "dewott_2",
        "pignite_2",
        "watchog_2",
        "zweilous_2",
        "swoobat_2",
        "emolga_2",
        "klang_2",
        "audino_2",
        "liepard_2",
        "basculin_2",
        "maractus_2",
        "simisage_2",
        "simisear_2",
        "simipour_2",
        "amoonguss_2",
        "eelektrik_2",
        "cinccino_2",
        "alomomola_2",
        "stunfisk_2",
        "galvantula_2",
        "swanna_2",
        "garbodor_2",
        "scolipede_2",
        "crustle_2",
        "sawsbuck_2",
        "whimsicott_2",
        "jellicent_2",
        "heatmor_2",
        "beheeyem_2",
        "beartic_2",
        "stoutland_2",
        "leavanny_2",
        "sigilyph_2",
        "bouffalant_2"
    ],
    "messages": [
        "Please go easy on me.\nI just finished my night shift.",
        "After all that work, let's relax\nwith some Pokémon battles!",
        "Yawn... I'm sleepy...\nI can't stay awake any longer..."
    ]
}
