{
    "$schema": "../../facility.schema.json",
    "name": "Min",
    "class": "TRAINER_CLASS_CYCLIST_F",
    "pokemon": [
        "gurdurr_1",
        "fraxure_1",
        "mienshao_1",
        "servine_1",
        "dewott_1",
        "pignite_1",
        "watchog_1",
        "zweilous_1",
        "swoobat_1",
        "emolga_1",
        "klang_1",
        "audino_1",
        "liepard_1",
        "basculin_1",
        "maractus_1",
        "simisage_1",
        "simisear_1",
        "simipour_1",
        "amoonguss_1",
        "eelektrik_1",
        "cinccino_1",
        "alomomola_1",
        "stunfisk_1",
        "galvantula_1",
        "swanna_1",
        "garbodor_1",
        "scolipede_1",
        "crustle_1",
        "sawsbuck_1",
        "whimsicott_1",
        "jellicent_1",
        "heatmor_1",
        "beheeyem_1",
        "beartic_1",
        "stoutland_1",
        "leavanny_1",
        "sigilyph_1",
        "bouffalant_1"
    ],
    "messages": [
        "I'm done! It's just not good enough.\nA Bicycle is not enough of a challenge.",
        "A Bicycle cannot satisfy me.\nI will join the Bikers!",
        "Faster!! I want a speed that nobody\ncan beat!"
    ]
}
